{
  "_comment": "Worked examples for K-IR v0.2's 8-object shape. Covers all 6 'particularly dangerous' cases from review, PLUS two v0.1 STRESS_TEST.md gaps the new shape fixes as a side effect (Finding 10 via Symbol.functional, Finding 6's implication case via Derivation), PLUS one demonstration of the generic-Context payoff (world=fiction). Deliberate non-fixes are annotated inline rather than hidden.",

  "symbols": [
    {"id": "R-REQUIRES", "label": "REQUIRES", "kind": "RELATION", "resolution_status": "RESOLVED", "functional": false, "notes": "A process can require many inputs -- set-valued, so two REQUIRES facts with different requirements are NOT contradictory."},
    {"id": "R-COMPOSED_OF", "label": "COMPOSED_OF", "kind": "RELATION", "resolution_status": "RESOLVED", "functional": null, "notes": "Deliberately null: whether 'what is dark matter made of' is single- or set-valued depends on whether the claim is about the WHOLE or a FRACTION. See P-DARKMATTER -- this unclassified case is exactly what Symbol.functional=null is for (unsafe to auto-derive contradictions from)."},
    {"id": "R-HOLDS", "label": "HOLDS", "kind": "RELATION", "resolution_status": "RESOLVED", "functional": null, "notes": "Generic catch-all carried over from v0.1; unsafe to auto-derive from. The v0.2 fix is to use a SPECIFIC relation symbol with a declared functional flag (see R-PRIMARY_MECHANISM / R-GUARANTEES) instead of overloading HOLDS."},
    {"id": "R-PRIMARY_MECHANISM", "label": "PRIMARY_MECHANISM", "kind": "RELATION", "resolution_status": "RESOLVED", "functional": true, "notes": "FIXES v0.1 FINDING 4: single-valued. Two assertions of PRIMARY_MECHANISM(BatchNorm, X) and PRIMARY_MECHANISM(BatchNorm, Y) with X != Y under the SAME context are now MECHANICALLY contradictory, exactly like x=3 vs x=5, with no hand-labeled CONTRADICTS edge."},
    {"id": "R-GUARANTEES", "label": "GUARANTEES", "kind": "RELATION", "resolution_status": "RESOLVED", "functional": false, "notes": "FIXES v0.1 FINDING 10: set-valued. A protocol guarantees many properties at once, so GUARANTEES(TCP, OrderedByteStream) and GUARANTEES(TCP, MessageBoundaries) are NOT auto-contradictory -- the second is simply false and is rejected at the evidence layer, not by a pairwise CONTRADICTS edge. Structurally identical to PRIMARY_MECHANISM but with the opposite flag: that flag is the whole difference, and v0.1 had nowhere to put it."},
    {"id": "R-DIFFERENTIABLE", "label": "DIFFERENTIABLE", "kind": "RELATION", "resolution_status": "RESOLVED", "functional": false},
    {"id": "R-CONTINUOUS", "label": "CONTINUOUS", "kind": "RELATION", "resolution_status": "RESOLVED", "functional": false},
    {"id": "R-EFFECTIVE", "label": "IS_EFFECTIVE_FOR", "kind": "RELATION", "resolution_status": "RESOLVED", "functional": false},
    {"id": "R-RECOMMENDED", "label": "IS_RECOMMENDED", "kind": "RELATION", "resolution_status": "RESOLVED", "functional": false},
    {"id": "R-IS_A", "label": "IS_A", "kind": "RELATION", "resolution_status": "RESOLVED", "functional": false},
    {"id": "R-RESIDES_AT", "label": "RESIDES_AT", "kind": "RELATION", "resolution_status": "RESOLVED", "functional": false},
    {"id": "R-UPDATE_RULE_OF", "label": "IS_UPDATE_RULE_OF", "kind": "RELATION", "resolution_status": "PROVISIONAL", "functional": false, "notes": "PROVISIONAL on purpose: invented while compiling the Adam example. Under v0.1 this would have been an unvalidated bare string with no trace that it was made up on the spot (Finding 0). It is still open-world -- nothing blocks it -- but it is now a registered, inspectable object flagged as unreviewed vocabulary."},

    {"id": "C-CHLOROPHYLL", "label": "chlorophyll", "kind": "CONCEPT", "resolution_status": "UNRESOLVED_PARENT", "parent": null, "provenance": {"source": "ingested user statement", "evidence_type": "ingested_unverified", "confidence": "established"}, "notes": "DANGEROUS CASE 1. Created on ingestion of 'Chlorophyll is needed for photosynthesis.' No Pigment/Molecule/ChemicalEntity supertype exists in this graph yet. The proposition below is still well-formed and epistemically SUPPORTED: concept resolution and epistemic status are INDEPENDENT axes. Knowledge does not wait for its ontology to be complete, and the compiler does not force chlorophyll onto the nearest existing concept."},
    {"id": "C-PHOTOSYNTHESIS", "label": "photosynthesis", "kind": "CONCEPT", "resolution_status": "UNRESOLVED_PARENT", "parent": null, "provenance": {"source": "ingested user statement", "evidence_type": "ingested_unverified", "confidence": "established"}, "notes": "Same as C-CHLOROPHYLL. Later resolving photosynthesis -> BiologicalProcess -> Process changes only this Symbol's parent field; P-CHLOROPHYLL's id and content are untouched."},

    {"id": "C-DARKMATTER", "label": "dark matter", "kind": "CONCEPT", "resolution_status": "RESOLVED", "parent": null},
    {"id": "C-PBH", "label": "primordial black holes", "kind": "CONCEPT", "resolution_status": "RESOLVED", "parent": null},

    {"id": "C-BANK-PROVISIONAL", "label": "bank", "kind": "CONCEPT", "resolution_status": "AMBIGUOUS", "parent": null, "ambiguous_candidates": ["C-BANK-FINANCIAL", "C-BANK-LANDFORM"], "provenance": {"source": "ingested from two unrelated sentences", "evidence_type": "ingested_unverified", "confidence": "hypothesis"}, "notes": "DANGEROUS CASE 4/5 SETUP. Both 'I deposited money at the bank' and 'I sat by the river bank' were ingested as this one symbol because nothing yet signalled two senses. Status moved PROVISIONAL -> AMBIGUOUS once incompatible properties appeared, then REV-002 split it."},
    {"id": "C-BANK-FINANCIAL", "label": "bank (financial institution)", "kind": "CONCEPT", "resolution_status": "RESOLVED", "parent": null, "aliases": ["bank"]},
    {"id": "C-BANK-LANDFORM", "label": "bank (landform)", "kind": "CONCEPT", "resolution_status": "RESOLVED", "parent": null, "aliases": ["bank", "riverbank"]},
    {"id": "C-FIN-INSTITUTION", "label": "financial institution", "kind": "CONCEPT", "resolution_status": "RESOLVED", "parent": null},
    {"id": "C-LANDFORM-NEAR-WATER", "label": "landform adjacent to water", "kind": "CONCEPT", "resolution_status": "RESOLVED", "parent": null},

    {"id": "C-TREATMENT-Z", "label": "treatment Z", "kind": "CONCEPT", "resolution_status": "RESOLVED", "parent": null},
    {"id": "C-PROTOCOL-Z", "label": "clinical protocol using treatment Z", "kind": "CONCEPT", "resolution_status": "RESOLVED", "parent": null},
    {"id": "C-COMPOUND-X", "label": "compound X", "kind": "CONCEPT", "resolution_status": "RESOLVED", "parent": null},
    {"id": "C-SYMPTOM-Y", "label": "symptom Y", "kind": "CONCEPT", "resolution_status": "RESOLVED", "parent": null},

    {"id": "C-BATCHNORM", "label": "batch normalization", "kind": "CONCEPT", "resolution_status": "RESOLVED", "parent": null},
    {"id": "C-ICS-REDUCTION", "label": "internal covariate shift reduction", "kind": "CONCEPT", "resolution_status": "RESOLVED", "parent": null},
    {"id": "C-LOSS-SMOOTHING", "label": "loss landscape smoothing", "kind": "CONCEPT", "resolution_status": "RESOLVED", "parent": null},
    {"id": "C-TCP", "label": "TCP", "kind": "CONCEPT", "resolution_status": "RESOLVED", "parent": null},
    {"id": "C-ORDERED-BYTE-STREAM", "label": "ordered byte stream delivery", "kind": "CONCEPT", "resolution_status": "RESOLVED", "parent": null},
    {"id": "C-MSG-BOUNDARIES", "label": "preservation of message boundaries", "kind": "CONCEPT", "resolution_status": "RESOLVED", "parent": null},

    {"id": "C-REAL-FUNCTION", "label": "real-valued function of a real variable", "kind": "CONCEPT", "resolution_status": "RESOLVED", "parent": null},
    {"id": "C-MOMENTUM", "label": "momentum (SGD with momentum)", "kind": "CONCEPT", "resolution_status": "RESOLVED", "parent": null},
    {"id": "C-RMSPROP", "label": "RMSProp", "kind": "CONCEPT", "resolution_status": "RESOLVED", "parent": null},
    {"id": "C-ADAM", "label": "Adam", "kind": "CONCEPT", "resolution_status": "RESOLVED", "parent": null},
    {"id": "C-FIRST-MOMENT", "label": "exponentially decayed first-moment estimate", "kind": "CONCEPT", "resolution_status": "RESOLVED", "parent": null},
    {"id": "C-SECOND-MOMENT", "label": "exponentially decayed second-moment estimate", "kind": "CONCEPT", "resolution_status": "RESOLVED", "parent": null},

    {"id": "C-HOLMES", "label": "Sherlock Holmes", "kind": "CONCEPT", "resolution_status": "RESOLVED", "parent": null},
    {"id": "C-221B", "label": "221B Baker Street", "kind": "CONCEPT", "resolution_status": "RESOLVED", "parent": null},
    {"id": "C-MUSEUM", "label": "museum", "kind": "CONCEPT", "resolution_status": "RESOLVED", "parent": null}
  ],

  "contexts": [
    {"id": "CTX-OXYGENIC", "constraints": [{"key": "organism_type", "op": "=", "value": "oxygenic_photosynthetic_organism"}]},
    {"id": "CTX-SAME-POPULATION", "constraints": [{"key": "patient_population", "op": "=", "value": "as_modeled_in_both_trials"}], "notes": "Deliberately coarse: if the two trials actually differed on an unmodeled variable (dosage, genetic subgroup), that is exactly what the INCONSISTENT status below is supposed to force someone to go find. The context must NOT be retro-fitted with a fake distinguishing key just to make the inconsistency disappear."},